faq,keywords
"What is Kolorpen device? A cutting-edge, non-invasive, painless medical aesthetic and cosmetic device, ensuring no skin contact, cross-contamination, or skin injury","cutting-edge, non-invasive, painless, medical aesthetic, cosmetic device, no skin contact, cross-contamination, skin injury, device, kolorpen"
"How does Kolorpen works? KolorPen utilizes piezoelectric tech to break liquid into micro-droplets, injecting them into the skin at high velocity for deep tissue penetration.","works, utilizes, piezoelectric technology, break liquid, micro-droplets, droplets, injecting, skin, high velocity, deep tissue penetration"
"What ensures the accuracy of KolorPen's procedure? KolorPen ensures procedure accuracy with a specialized nozzle for narrow insertion, enabling micro-droplets (50?m-200?m) for precise and controlled delivery.","accuracy, procedure, specialized nozzle, narrow insertion, micro-droplets, droplets, precise, controlled delivery"
"How fast does the KolorPen system operate? The KolorPen system delivers 100 droplets/sec at 350m/sec for swift, efficient treatment sessions.","fast, quick, speed, operate, delivers, swift, rapid, efficient, effective"
"Can the volume of the micro-droplets be adjusted? Yes, via a wireless tablet, users can control volume (200nL-500nL) for tailored treatment","volume, micro-droplets, droplets, adjusted, wireless tablet, control"
"What are the advantages of using KolorPen? KolorPen provides painless, non-invasive treatment with no bleeding, contamination risk, shorter recovery time, and immediate healing without redness or swelling","advantages, painless, non-invasive, bleeding, contamination, recovery, healing, redness, swelling, benefits, pros, pain"
"How does the patient feel after a treatment that used KolorPen? After treatment, patients have instant recovery, enhancing safety and satisfaction","patient, feel, treatment, experience, recovery, safety, satisfaction, person"
"Is there any downtime after undergoing a KolorPen procedure? No healing or downtime with KolorPen, enabling a quick return to regular activities","downtime, inactivity, undergoing, experiencing, procedure, no healing, quick return, regular activities, quick, rapid, swift, return, comeback"
"How does the KolorPen's authentication and security system work? KolorPen employs QR code authentication via a wireless tablet. Only approved products can activate it, and the company records all related data on their server","authentication, security system, QR, wireless tablet, approved products, activate, company records, related data, server"
How does KolorPen maintain sterility during procedures? It uses sterile sealed disposable containers designed for medical use to reduce contamination risks and maintain hygiene standards,"sterility, procedures, sterile, disposable, medical use, contamination, hygiene, uncontaminated"
"What is micro-pigmentation, and how does KolorPen technology improve it? Micro-pigmentation enhances facial features and conceals scars. KolorPen offers precise, hygienic, low-infection-risk, and faster-healing benefits without skin contact","micro-pigmentation, pigmentation, enhancements, facial, face, scar, precision, hygiene, infection, healing, no skin contact"
"What are the benefits of the hot micro-droplet insertion technique? KolorPen's method stimulates collagen, rejuvenates the skin, and improves wrinkles and skin texture, all within a single, efficient session","micro-droplet, droplets, benefits, collagen, rejuvenates, wrinkles, skin texture, efficiency"
"At what temperature does KolorPen operate and why? KolorPen uses warm micro-droplets at 0-100°C to promote collagen build-up and provide therapeutic benefits, ensuring effectiveness on all skin types","temperature, warm micro-droplets, droplets, collagen, benefits, effectiveness"
"What can KolorPen treat? It addresses aesthetic concerns like psoriasis, acne, wrinkles, spider veins, alopecia, dermal treatments, dental procedures, hair transplants, micropigmentation, and skin medication delivery","treat, treatments, address, aesthetic concerns, psoriasis, acne, wrinkles, spider veins, alopecia, dermal treatments, dental procedures, hair transplants, micropigmentation, skin medication delivery"
"What features does KolorPen CRM offer for customer management? It has individual customer folders, consent form storage, before-and-after photo management, an intuitive appointment system, and comprehensive treatment records to track client history and progress","CRM, customer management, individual customer folders, consent form storage, before-and-after photos, appointment system, treatment records, track client history, progress"
"How does KolorPen enhance skincare product absorption? It penetrates controlled micro-droplets onto cream-coated skin, maximizing absorption and delivering active ingredients for optimal therapeutic effects","enhance, skincare product absorption, penetrates, controlled micro-droplets, cream-coated skin, maximizing absorption, delivering active ingredients, optimal therapeutic effects"
"What sets KolorPen apart from traditional micro-needling? It offers enhanced absorption, precision, non-invasiveness, painlessness, and faster recovery, making it superior to traditional methods","micro-needling, enhanced absorption, precision, non-invasiveness, painlessness, faster recovery, superiority, unique, kolorpen"
"How does KolorPen's appointment system benefit therapists and clients? It offers an advanced, intuitive, and customizable scheduling system that streamlines booking and makes appointment management efficient and convenient for all","appointment, benefits, therapists, clients, advanced, intuitive, customizable scheduling, streamlines booking, efficient, convenient, booking"
"KolorPen Ltd. is a pioneering company specializing in piezoelectric technology for non-invasive cosmetics and medical aesthetics.
Our team consists of experts in physics, chemistry, electronics, micro-mechanics, and software development. Together, we have developed a unique solution based on Piezoelectric Technology for micro droplets insertion, which has undergone extensive internal and external testing to validate its efficacy.

In collaboration with the Tissue Research Institute of HaEmek Hospital, we conducted histological tests to ensure the safety and effectiveness of KolorPen applications. This partnership has further demonstrated the potential of our solution for cosmetics and medical aesthetics treatments. At KolorPen, we are committed to pushing the boundaries of innovation and providing advanced non-invasive solutions that deliver exceptional results.


KolorPen continuously develops new applications, as well as developing new products. In order to achieve these goals, KolorPen is open to team up with strategic partners and investors.","KolorPen, about, pioneering, piezoelectric technology, non-invasive cosmetics, medical aesthetics, expert team, physics, chemistry, electronics, micro-mechanics, software development, unique solution, micro droplets insertion, extensive testing, efficacy validation, Tissue Research Institute, HaEmek Hospital, histological tests, safety, effectiveness, cosmetics treatments, medical aesthetics treatments, innovation, advanced solutions, exceptional results, continuous development, new applications, products, strategic partnerships, investors"
"Micro-Droplet Control Our advanced system offers a wide range of capabilities that enable precise control over the properties of micro-droplets. This level of control allows for customization to meet specific requirements with utmost accuracy. Key aspects that can be controlled include droplet volume, depth of penetration, velocity, dose, and temperature.

By having such precise control over these parameters, our system ensures that the desired outcome is achieved. The system provides the necessary precision to work with comfort and confidence.

Additionally, the ability to generate very thin lines is one of the remarkable results achieved with this level of control. This capability opens up new possibilities in micropigmentation applications where precision and fine details are crucial.","Micro-Droplet Control, droplets, advanced system, precise control, micro-droplets, customization, accuracy, droplet volume, penetration depth, velocity, dose, temperature, desired outcome, comfort, confidence, thin lines, micropigmentation applications, precision, fine details"
"Enhanced Security Measures KolorPen has implemented an authentication and security system that utilizes a password embedded within a QR code.

To activate the system, users must scan the proprietary QR code, protected by a password, using the KolorPen wireless tablet application. This ensures that only approved liquids can activate the system.

The KolorPen management server records various product events, including the type of liquid used, signed consent forms, quantities of pigments used, and more","Enhanced Security Measures, authentication, security system, password, QR code, activate, proprietary, wireless tablet application, approved liquids, management server, product events, liquid type, signed consent forms, pigment quantities"
"Efficient Data Recording Our platform enables seamless and efficient two-way data transfer between Therapists and the Server, promote effective communication and empowering multiple business models.

With the ability to transfer information in real-time, our system allows

Therapists to receive essential data such as white papers, sales promotions, and more.

This ensures that Therapists stay up-to-date and have access to relevant information for their practice","data, Data Recording, seamless, two-way data transfer, therapists, server, effective communication, empowering, business models, real-time information, white papers, sales promotions, up-to-date, relevant information"
"Our Cutting-edge Technology KolorPen is a needle-free injection device that uses piezoelectric energy to break liquids into micro-droplets. These micro-droplets are then inserted into the skin at a high velocity. This method of injection is precise and rapid, and it can be used for a variety of applications, including micro-pigmentation, cosmetic, medical aesthetics, drug delivery, and vaccinations. KolorPen is particularly advantageous for painless and efficient delivery of local anesthetics and medical compositions. In addition to its medical applications, KolorPen can also be used for cosmetic purposes. It provides a precise and comfortable alternative to traditional methods of injection. KolorPen is a versatile and adaptable system that offers features such as wireless control of micro droplet speed, volume, depth, temperature, and dose","Technology, KolorPen, needle, tech, needle-free, injection device, piezoelectric energy, micro-droplets, high velocity, precise, rapid, applications, micro-pigmentation, cosmetic, medical aesthetics, drug delivery, vaccinations, painless, efficient delivery, local anesthetics, medical compositions, cosmetic purposes, comfortable alternative, traditional injection methods, versatile, adaptable, wireless control, droplet speed, volume, depth, temperature, dose"
"Safety and Disposable Container KolorPen system incorporates a sterile, sealed, and disposable container specifically designed for medical use. This cutting-edge technology provides a safe and sterile environment to hold medical liquids for procedures, significantly minimizing the risk of contamination.

Sterility is of paramount importance in medical and aesthetic procedures to prevent infection and ensure patient safety.

Single-use sterile containers are required to hold and transport the therapeutic substances. These containers must be designed to maintain sterility throughout the treatment process, from substance storage to administration. The development of suitable sterile packaging is critical to meet medical and regulatory standards.

The containers can be easily discarded after use, which upholds stringent hygiene standards in medical settings. Their disposable nature reduces the time and resources spent on sterilization, promoting efficiency.

KolorPen system offers an advanced solution for the safe, precise, and efficient delivery of medical liquids, while ensuring maximum sterility and user convenience.","Safety, safe, Disposable Container, sterile, sealed, medical use, cutting-edge technology, safe environment, medical liquids, minimize contamination risk, sterility, medical procedures, aesthetic procedures, prevent infection, patient safety, single-use containers, therapeutic substances, maintain sterility, treatment process, sterile packaging, medical standards, regulatory standards, discard after use, uphold hygiene, reduce sterilization time, promote efficiency, advanced solution, precise delivery, efficient delivery, maximum sterility, user convenience."
"As a versatile tool, KolorPen device caters to a broad spectrum of treatments, delivering transformative solutions for concerns such as alopecia, hyperhidrosis, spider veins, and facilitating procedures like eyelids raising. Its adeptness extends to addressing wrinkles, acne, allergies, and even assists in precise medication delivery for anesthesia and other therapeutic requirements.

Engineered with cutting-edge piezoelectric technology, KolorPen revolutionizes micro-droplet insertion, offering unparalleled precision and control in creating intricate and fine details on the skin. Be it permanent makeup or skin rejuvenation, KolorPen emerges as a quintessential tool, fostering innovation and safety in the aesthetic domain. Its prowess in micropigmentation stands unparalleled, enabling professionals to craft subtle enhancements and conceal scars with finesse.

Furthermore, KolorPen stands as a vanguard in offering a needle-free micro-needling alternative, maximizing skincare product absorption while ensuring a painless, gentle, and non-invasive experience.","Versatile Tool, Broad Spectrum, Treatments, Transformative Solutions, Alopecia, Hyperhidrosis, Spider Veins, Eyelids Raising, Wrinkles, Acne, Allergies, Precise Medication Delivery, Anesthesia, Therapeutic Requirements, Cutting-edge, Piezoelectric Technology, Micro-droplet Insertion, Precision, Control, Intricate Details, Skin, Permanent Makeup, Skin Rejuvenation, Quintessential Tool, Innovation, Safety, Aesthetic Domain, Micropigmentation, Subtle Enhancements, Scar Concealment, Needle-free Alternative, Micro-needling, Skincare Absorption, Painless, Gentle, Non-invasive Experience"
"Micro Pigmentation Enhances Your Beauty
Micro-pigmentation is a semi-permanent cosmetic technique that enhances facial features and can be used to conceal scars resulting from injuries or surgeries.

KolorPen technology is a non-invasive micro-pigmentation procedure that offers exceptional precision without touching the skin. This ensures the highest level of accuracy and hygiene, minimizing the risk of infections.

To use the device, simply hover it over the skin and the pigments will penetrate.

Benefits of KolorPen technology

Exceptional precision without touching the skin
Hygienic and reduces the risk of infections
Non-invasive for faster healing and a comfortable experience
No pain
No skin injury
No epidermal damage
Results with a very fine lines

Micro Pigmentation Histology Reports
In an experiment where blue pigment was introduced into pig skin and the results analyzed using histological examination, it was clearly observed that:

Depth of Penetration: The blue pigment managed to penetrate deep into the skin, reaching a remarkable depth of approximately 1,000 microns.
Width of Penetration: The spread of the pigment in the horizontal plane (width) was about 250 microns.
Penetration Point: The initial point where the pigment entered the skin was observed to be around 35 microns.

The most significant revelation from this study came from the histological examination. Histology involves the study of the microscopic anatomy of cells and tissues. In this context, the histological analysis showed:

Epidermis Preservation: Despite the depth and width of the pigment’s penetration, the epidermis remained undamaged. This is crucial because damage to the epidermis can lead to various complications, including potential infections, scarring, or other adverse reactions.
Promising Outcomes: The fact that there’s no observed damage to the epidermis while achieving deep penetration suggests that KolorPen non-invasive, needle-free method will have benefits in applications where deep skin penetration without surface damage is desired.

The histological examination, was conducted at a reputable institution: the Tissue Research Institute of Haemek Hospital in Israel.","Micro Pigmentation, Pigmentation, Beauty Enhancement, Semi-permanent, Cosmetic Technique, Facial Features, Scar Concealment, Injuries, Surgeries, KolorPen Technology, Non-invasive, Exceptional Precision, No Skin Contact, Accuracy, Hygiene, Minimized Infection Risk, Comfortable Experience, No Pain, No Skin Injury, No Epidermal Damage, Fine Lines, Histology Reports, Blue Pigment, Pig Skin, Depth of Penetration, Width of Penetration, Penetration Point, Microscopic Anatomy, Cells, Tissues, Epidermis Preservation, No Damage, Deep Skin Penetration, Tissue Research Institute, Haemek Hospital, Israel"
"Collagen Buildup for Skin Tightening

New technique for Collagen Buildup

Our revolutionary technique, hot micro-droplet insertion, offers exceptional benefits. Unlike any other technology available today, this innovative approach allows for precise delivery of hot micro-droplets into the skin.

Thus, our system stimulates collagen buildup within the skin. This stimulation of collagen synthesis promotes skin rejuvenation and helps address various skin concerns, wrinkles, and uneven skin texture. Additionally, Using the therapeutic liquid brings dual benefits in a single treatment session: it promotes collagen production and delivers the therapeutic effects of the liquid itself. This approach maximizes the treatment’s efficiency and enhances comfort for the individual.

Our technology offers a unique and advanced solution that combines the benefits of collagen stimulation and therapeutic effects in a single treatment session.

Histology Report of Hot Micro-Droplets Insertion
The KolorPen system utilizes warm micro-droplets (20°-70°C), a sophisticated method that delivers dual benefits: it stimulates collagen production in the skin and administers therapeutic effects through the micro-droplets. This advanced technique is designed to work effectively on all skin colors, making it a versatile solution for diverse individuals.

Through careful control of the depth of insertion, temperature, and dosage, the KolorPen system ensures that energy is delivered at precise temperatures to exact depths, minimizing the risk of complications and resulting in significantly less discomfort compared to other methods.

In summary, the histological analysis underscores the remarkable capabilities of the KolorPen system. It showcases not only its ability to foster collagen growth but also its proficiency in delivering therapeutic benefits with optimized comfort and safety. This makes it a promising tool for achieving desired outcomes across all skin types with significantly reduced risks and enhanced comfort for the individual.","Collagen, Skin Tightening, New Technique, Micro-Droplet, droplet, Exceptional Benefits, Precise Delivery, Skin Stimulation, Collagen Synthesis, Skin Rejuvenation, Addressing Skin Concerns, Wrinkles, Uneven Texture, Therapeutic Liquid, Dual Benefits, Single Treatment Session, Maximizing Efficiency, Enhanced Comfort, Advanced Solution, Combining Benefits, Collagen Stimulation, Therapeutic Effects, Histology Report, Warm Micro-Droplets, Sophisticated Method, All Skin Colors, Versatile Solution, Careful Control, Depth of Insertion, Temperature, Dosage, Precise Energy Delivery, Minimized Complications, Less Discomfort, Remarkable Capabilities, Fostering Collagen Growth, Proficient Therapeutic Delivery, Optimized Comfort, Safety, Promising Tool, Desired Outcomes, All Skin Types, Reduced Risks"
"Needle-Free Micro-Needling Alternative
Introducing KolorPen’s Needle-Free Micro-Needling Alternative: KolorPen’s innovative approach departs from conventional needle-based procedures, offering a refined, comfortable, and virtually painless experience. With precision and control, our technology delivers micro-needling benefits without the need for actual needles, providing a gentle and non-invasive solution for skin revitalization. Whether your goal is to reduce fine lines, minimize pore size, or enhance overall skin texture, our Needle-Free Micro-Needling Alternative delivers outstanding results comparable to traditional methods, all with added comfort and convenience.

Therapeutic Liquid Insertion
KolorPen technology enables the precise application of high-viscosity materials into the skin. This process offers a targeted and effective method for delivering therapeutic substances, allowing for enhanced skincare and treatment outcomes.
Improved Absorption: Our micro-droplets effectively deliver active ingredients for optimal absorption.
Precision and Control: Target specific areas with greater accuracy and customization.
Non-Invasive: painless and gentle procedure, without the discomfort associated with traditional micro-needling.
Reduced Downtime: Minimal recovery time, allowing quickly return to daily activities.","Needle-Free, needle, Micro-Needling, Alternative, Innovative approach, Conventional, Needle-based procedures, Refined, Comfortable, Virtually painless, Precision, Control, Technology, Skin revitalization, Reduce, Fine lines, Minimize, Pore size, Enhance, Skin texture, Outstanding results, Traditional methods, Comfort, Convenience, Therapeutic Liquid, High-viscosity materials, Targeted, Effective, Delivering, Therapeutic substances, Enhanced skincare, Treatment outcomes, Improved Absorption, Micro-droplets, Active ingredients, Optimal absorption, Accuracy, Customization, Non-Invasive, Discomfort, Reduced Downtime, Minimal recovery, Daily activities"
"Face Spider Veins Treatments
With the innovative KolorPen system, Spider Veins treatments have reached a new level of precision. This advanced technology allows for a highly accurate and targeted approach, ensuring that the treatment is focused precisely on the affected areas.

During the procedure, the therapeutic micro-drops are inserted exactly to the necessary depth, regardless of the skin type and without the risk of pigmentation to the skin. This element of the treatment ensures that it’s adapted to individual patient needs, offering a personalized approach to spider veins treatment.

The treatment is carried out in a completely hygienic manner, reducing the risk of infections or complications. This is particularly important when dealing with sensitive areas like the face.

During the procedure, the Spider Veins lines are being delicately “drawn” with the therapeutic liquid. The application process is gentle and meticulously controlled, ensuring that only the targeted veins are treated.","Face, Spider Veins, spider, veins, Treatments, Innovative, Advanced technology, Accurate, Targeted approach, Affected areas, Procedure, Therapeutic micro-drops, Necessary depth, Skin type, Risk, Pigmentation, Adapted, Individual patient needs, Personalized approach, Hygienic, Infections, Complications, Sensitive areas, Lines, Delicately, “drawn”, Therapeutic liquid, Application process, Gentle, Meticulously controlled"
"Local anesthesia.
In the KolorPen procedure, a numbing agent like lidocaine is used to create micro-droplets of anesthetic solution. These droplets are then injected into the targeted area to induce numbness, minimizing discomfort during the treatment.

For instance, consider the hair transplant procedure at Dr. Ginzburg’s clinic. In this procedure, tissue from the back of the head is removed and then transplanted to a bald area at the front. This technique usually involves a significant amount of pain because it requires multiple needle insertions in both the area where the tissue is taken from (the donor site) and the area where it is transplanted to (the recipient site).

However, at Dr. Ginzburg’s clinic, this pain and discomfort are effectively mitigated using the KolorPen system. This technology enables Dr. Ginzburg to numb the respective areas in a pain-free manner before proceeding with the needle injections, thus making the whole process much more comfortable for the patient.","Local anesthesia, anesthesia, procedure, Numbing agent, Lidocaine, Micro-droplets, Anesthetic solution, Injected, Targeted area, Numbness, Discomfort, Treatment, Hair transplant, Dr. Ginzburg’s clinic, Tissue, Back of the head, Transplanted, Bald area, Front, Pain, Multiple needle insertions, Donor site, Recipient site, Pain-free, Technology, Comfortable, Patient"
